{
  "schemaVersion": 3,
  "exampleNotice": "本文件中的人物、组织、学校、经历和成果数据均为虚构，仅用于演示，请替换为真实且有权使用的内容。",
  "name": "示例用户（虚构）",
  "title": "Java 后端工程师",
  "experience": "3 年经验",
  "theme": "navy",
  "style": {
    "spacing": {
      "resume-line-height": 1.2,
      "resume-body-padding-y": 11,
      "resume-section-gap": 12,
      "resume-entry-gap": 16,
      "resume-list-gap": 3
    }
  },
  "order": ["header", "summary", "work", "projects", "skills", "education"],
  "contactMethod": {"items": [
    {"label": "手机", "value": "请替换"},
    {"label": "邮箱", "value": "user@example.com"},
    {"label": "意向", "value": "杭州"}
  ]},
  "summary": {"items": [
    "3 年 Java 后端开发经验，具备需求分析、接口设计、服务开发、联调与线上问题排查能力。",
    "熟练使用 Spring Boot、MySQL、Redis，关注服务性能、稳定性和可维护性。"
  ]},
  "work": [
    {
      "company": "示例科技有限公司（虚构）",
      "position": "Java 后端工程师",
      "date": "2023年7月至今",
      "summary": [
        "负责企业服务平台的后端服务开发、接口联调与线上问题处理，覆盖订单、客户与运营等核心业务模块。",
        "参与需求评审、接口设计和上线复盘，将异常场景、日志字段与排查步骤沉淀为团队规范。",
        "维护异步任务和缓存相关代码，配合测试完成回归验证，并处理不同环境的配置差异。",
        "与前端、产品和运维协作梳理发布清单，确保示例系统在功能演示和数据隔离方面保持可控。"
      ]
    },
    {
      "company": "云桥软件工作室（虚构）",
      "position": "后端开发工程师",
      "date": "2021年7月–2023年6月",
      "summary": [
        "参与多租户业务系统的服务拆分和数据模型设计，为管理端与开放接口提供统一的权限校验能力。",
        "编写批处理、导入导出和消息消费模块，针对失败场景补充重试、告警和人工处理入口。",
        "协助建设接口文档和本地调试脚本，减少跨角色沟通时因环境和参数不一致产生的问题。",
        "持续整理遗留模块的依赖关系，逐步替换重复逻辑并补充边界条件测试用例。"
      ]
    },
    {
      "company": "星图数字服务中心（虚构）",
      "position": "Java 开发实习生",
      "date": "2020年7月–2021年6月",
      "summary": [
        "参与内部运营工具的功能迭代，完成表单校验、查询接口和管理页面所需的数据服务。",
        "跟随导师排查开发和测试环境问题，记录复现步骤并协助完善部署前检查项。",
        "维护基础字典和报表任务，学习使用关系型数据库、缓存与日志检索工具进行日常排障。"
      ]
    }
  ],
  "projects": [
    {
      "name": "企业服务管理平台（虚构）",
      "date": "2024年3月至今",
      "background": "面向虚构企业客户的统一服务管理平台示例，用于演示从申请、审核到履约跟踪的完整后台协作流程。",
      "techStack": "Java、Spring Boot、MyBatis、MySQL、Redis",
      "role": "后端开发工程师",
      "summary": [
        "设计 RESTful 接口、参数校验和领域服务分层，完成核心业务服务及数据持久化实现。",
        "为查询场景补充组合索引、缓存失效策略和分页约束，便于展示不同数据规模下的处理方式。",
        "梳理状态流转与异常分支，为审核退回、重复提交和超时处理提供明确的接口反馈。",
        "维护接口示例、联调清单和回归用例，帮助使用者理解每个模块的输入、输出与依赖关系。"
      ]
    },
    {
      "name": "报价与预约协同服务（虚构）",
      "date": "2023年9月–2024年2月",
      "background": "虚构的 B2B 协同服务样例，展示报价草稿、审核记录、预约时间段和通知任务之间的关联。",
      "techStack": "Java、Spring Boot、MySQL、RabbitMQ、Docker",
      "role": "后端开发工程师",
      "summary": [
        "实现报价草稿保存、版本比对和审核流转接口，并以幂等键约束重复请求。",
        "设计预约时间段校验逻辑，处理可用性查询、冲突提示和取消后的状态恢复。",
        "通过消息队列分发通知任务，将发送记录与业务状态分离，便于失败重试和人工确认。",
        "为演示环境提供初始化数据和可重复执行的脚本，确保每次体验都有可观察的完整流程。"
      ]
    },
    {
      "name": "客户运营数据工作台（虚构）",
      "date": "2022年6月–2023年8月",
      "background": "用于演示客户标签、运营活动和任务处理进度的虚构数据工作台，强调可筛选、可追溯的后台操作体验。",
      "techStack": "Java、Spring MVC、MyBatis、MySQL、Elasticsearch",
      "role": "后端开发工程师",
      "summary": [
        "完成客户标签、活动任务和处理记录的接口设计，支持按负责人、状态和时间范围组合筛选。",
        "抽取通用分页、排序和权限过滤逻辑，减少各个列表接口之间的重复实现。",
        "为检索结果补充高亮、空状态和错误状态所需的数据结构，方便前端直接渲染。",
        "整理日志检索字段与问题定位步骤，使演示数据的来源和变更路径更容易追踪。"
      ]
    },
    {
      "name": "研发知识库与任务助手（虚构）",
      "date": "2021年8月–2022年5月",
      "background": "面向研发团队的虚构知识库样例，包含文档分类、任务跟踪、检索索引和协作备注等基础能力。",
      "techStack": "Java、Spring Boot、MySQL、Redis、MinIO",
      "role": "后端开发工程师",
      "summary": [
        "实现文档目录、标签和访问权限的基础模型，为不同团队提供隔离但可协作的内容空间。",
        "设计任务状态、备注和附件关联接口，覆盖创建、分派、关闭和重新打开等常见操作。",
        "补充缓存与文件元数据校验，避免展示层读取到过期或不存在的示例资源。",
        "编写本地初始化说明与错误排查指南，使新使用者能快速恢复一个可演示的数据集。"
      ]
    }
  ],
  "skills": [
    {"level": "熟练掌握", "content": "Java，了解 JavaScript、Python。"},
    {"level": "熟练掌握", "content": "Spring Boot、Spring，熟悉 MyBatis。"},
    {"level": "熟悉", "content": "MySQL、Redis、Elasticsearch。"}
  ],
  "education": [{"institution": "示例大学（虚构）", "degree": "学士，计算机科学与技术", "date": "2019年9月–2023年6月"}]
}
